{
  "schemaVersion": 1,
  "kind": "external-ingress-registry",
  "scanRules": [
    {
      "ruleId": "external-media-sandbox",
      "roots": ["scripts/producer"],
      "suffixes": [".py"],
      "token": "admit_external_media(",
      "expectedOccurrenceCount": 3
    },
    {
      "ruleId": "external-media-sandbox-alias",
      "roots": ["scripts/producer"],
      "suffixes": [".py"],
      "token": "runner or admit_external_media",
      "expectedOccurrenceCount": 1
    },
    {
      "ruleId": "reference-media-admission",
      "roots": ["src/app/api"],
      "suffixes": [".ts"],
      "token": "admitReferenceMedia(",
      "expectedOccurrenceCount": 3
    },
    {
      "ruleId": "reference-text-admission",
      "roots": ["src/app/api"],
      "suffixes": [".ts"],
      "token": "admitReferenceVtt(",
      "expectedOccurrenceCount": 4
    },
    {
      "ruleId": "managed-source-copy",
      "roots": ["src/app/api/producer/ingest"],
      "suffixes": [".ts"],
      "token": "copyStableSource(",
      "expectedOccurrenceCount": 2
    },
    {
      "ruleId": "palmier-media-import",
      "roots": ["scripts/producer"],
      "suffixes": [".py"],
      "token": "call_json(\"import_media\"",
      "expectedOccurrenceCount": 2
    },
    {
      "ruleId": "sealed-archive-verification",
      "roots": ["scripts/producer"],
      "suffixes": [".py"],
      "token": "verify_archive_file(",
      "expectedOccurrenceCount": 5
    },
    {
      "ruleId": "legacy-admission-escape",
      "roots": ["scripts/producer"],
      "suffixes": [".py"],
      "token": "--allow-legacy-unadmitted",
      "expectedOccurrenceCount": 6
    },
    {
      "ruleId": "product-legacy-admission-escape",
      "roots": ["src/app/api/producer"],
      "suffixes": [".ts"],
      "token": "--allow-legacy-unadmitted",
      "expectedOccurrenceCount": 0
    }
  ],
  "families": [
    {
      "id": "canonical-project-media",
      "classification": "sandbox-admitted-media",
      "released": true,
      "entryPoints": [
        "src/app/api/producer/ingest/route.ts",
        "scripts/producer/ingest.py"
      ],
      "authorityPaths": [
        "src/app/api/producer/ingest/source-copy.ts",
        "scripts/producer/ingest_admission.py",
        "scripts/producer/ingest_admission_contract.py",
        "scripts/producer/ingest_execution_authority.py"
      ],
      "promotionPaths": [
        "scripts/producer/source_set_receipt_authority.py",
        "scripts/producer/current_render_graph_source_gate.py"
      ],
      "testPaths": [
        "scripts/producer/tests/test_ingest_admission.py",
        "scripts/producer/tests/test_ingest_execution_authority.py",
        "scripts/producer/tests/live_ingest_admission_acceptance.py"
      ],
      "ownership": [
        {
          "ruleId": "external-media-sandbox-alias",
          "path": "scripts/producer/ingest_admission.py",
          "sourceToken": "runner or admit_external_media",
          "expectedOccurrences": 1
        },
        {
          "ruleId": "managed-source-copy",
          "path": "src/app/api/producer/ingest/source-copy.ts",
          "sourceToken": "function copyStableSource(",
          "expectedOccurrences": 1
        },
        {
          "ruleId": "managed-source-copy",
          "path": "src/app/api/producer/ingest/target.ts",
          "sourceToken": "await copyStableSource(",
          "expectedOccurrences": 1
        }
      ],
      "notes": "Source, b-roll, and project music converge on immutable full-decode snapshots; the TypeScript copy is stable staging, not a substitute for sandbox admission."
    },
    {
      "id": "external-media-probe-primitive",
      "classification": "sandbox-admitted-media",
      "released": true,
      "entryPoints": [
        "scripts/producer/headless/external_media_probe.py"
      ],
      "authorityPaths": [
        "scripts/producer/headless/external_media_snapshot.py",
        "scripts/producer/headless/external_media_probe_policy.py",
        "scripts/producer/headless/container_policy.py"
      ],
      "promotionPaths": [],
      "testPaths": [
        "scripts/producer/tests/test_external_media_probe.py",
        "scripts/producer/tests/live_external_media_probe_acceptance.py",
        "scripts/producer/tests/live_p0_adversarial_ingress_acceptance.py",
        "scripts/producer/tests/test_p0_adversarial_ingress_artifact.py"
      ],
      "ownership": [
        {
          "ruleId": "external-media-sandbox",
          "path": "scripts/producer/headless/external_media_probe.py",
          "sourceToken": "def admit_external_media(",
          "expectedOccurrences": 1
        }
      ],
      "notes": "The shared primitive owns immutable copy, approved-image attestation, non-root networkless full decode, bounded cleanup, and reobservation."
    },
    {
      "id": "reference-video",
      "classification": "sandbox-admitted-media",
      "released": true,
      "entryPoints": [
        "src/app/api/producer/references/route.ts",
        "src/app/api/producer/references/fetch/route.ts"
      ],
      "authorityPaths": [
        "src/app/api/_lib/reference-media-admission.ts",
        "scripts/producer/headless/admit_external_media_cli.py",
        "src/app/api/_lib/reference-admission-verifier.ts"
      ],
      "promotionPaths": [
        "src/app/api/_lib/reference-library.ts"
      ],
      "testPaths": [
        "src/lib/producer/__tests__/reference-admission-verifier.test.ts",
        "src/lib/producer/__tests__/reference-library.test.ts",
        "scripts/producer/tests/test_reference_intake.py"
      ],
      "ownership": [
        {
          "ruleId": "external-media-sandbox",
          "path": "scripts/producer/headless/admit_external_media_cli.py",
          "sourceToken": "admit_external_media(source, str(root), REFERENCE_LIMITS)",
          "expectedOccurrences": 1
        },
        {
          "ruleId": "reference-media-admission",
          "path": "src/app/api/_lib/reference-media-admission.ts",
          "sourceToken": "function admitReferenceMedia(",
          "expectedOccurrences": 1
        },
        {
          "ruleId": "reference-media-admission",
          "path": "src/app/api/producer/references/route.ts",
          "sourceToken": "await admitReferenceMedia(",
          "expectedOccurrences": 1
        },
        {
          "ruleId": "reference-media-admission",
          "path": "src/app/api/producer/references/fetch/route.ts",
          "sourceToken": "await admitReferenceMedia(",
          "expectedOccurrences": 1
        }
      ],
      "notes": "Local and downloaded reference videos use the same full-decode primitive and a separate content-addressed reference authority."
    },
    {
      "id": "reference-vtt",
      "classification": "descriptor-admitted-text",
      "released": true,
      "entryPoints": [
        "src/app/api/producer/references/route.ts",
        "src/app/api/producer/references/fetch/route.ts"
      ],
      "authorityPaths": [
        "src/app/api/_lib/reference-sidecar.ts",
        "src/app/api/_lib/reference-admission-verifier.ts"
      ],
      "promotionPaths": [
        "src/app/api/_lib/reference-library.ts"
      ],
      "testPaths": [
        "src/lib/producer/__tests__/reference-sidecar.test.ts",
        "src/lib/producer/__tests__/reference-admission-verifier.test.ts"
      ],
      "ownership": [
        {
          "ruleId": "reference-text-admission",
          "path": "src/app/api/_lib/reference-sidecar.ts",
          "sourceToken": "function admitReferenceVtt(",
          "expectedOccurrences": 1
        },
        {
          "ruleId": "reference-text-admission",
          "path": "src/app/api/_lib/reference-sidecar.ts",
          "sourceToken": "return admitReferenceVtt(",
          "expectedOccurrences": 1
        },
        {
          "ruleId": "reference-text-admission",
          "path": "src/app/api/producer/references/route.ts",
          "sourceToken": "return admitReferenceVtt(",
          "expectedOccurrences": 1
        },
        {
          "ruleId": "reference-text-admission",
          "path": "src/app/api/producer/references/fetch/route.ts",
          "sourceToken": "return admitReferenceVtt(",
          "expectedOccurrences": 1
        }
      ],
      "notes": "VTT is bounded text, not decoder media; it uses no-follow held-descriptor copy plus a content-addressed receipt and downstream byte rehash."
    },
    {
      "id": "scene-package-assets",
      "classification": "sandbox-admitted-media",
      "released": true,
      "entryPoints": [
        "scripts/producer/graphics/scene_package_cli.py"
      ],
      "authorityPaths": [
        "scripts/producer/graphics/asset_governance.py",
        "scripts/producer/graphics/scene_package_assets.py",
        "scripts/producer/graphics/scene_package_render.py"
      ],
      "promotionPaths": [
        "scripts/producer/graphics/scene_package_contract.py"
      ],
      "testPaths": [
        "scripts/producer/tests/test_scene_package_assets.py",
        "scripts/producer/tests/live_scene_package_cli_acceptance.py"
      ],
      "ownership": [
        {
          "ruleId": "external-media-sandbox",
          "path": "scripts/producer/graphics/scene_package_assets.py",
          "sourceToken": "admit_external_media(package_asset[\"blobPath\"], store)",
          "expectedOccurrences": 1
        }
      ],
      "notes": "Generated or acquired scene assets must pass byte, rights, attribution, and sandbox decode authority before package publication."
    },
    {
      "id": "sealed-render-archives",
      "classification": "sealed-archive",
      "released": true,
      "entryPoints": [
        "scripts/producer/headless/container_io.py",
        "scripts/producer/headless/overlay_source_seal.py",
        "scripts/producer/headless/render_layout_contract.py"
      ],
      "authorityPaths": [
        "scripts/producer/headless/sealed_archive.py",